감정명,문장 예시
억울함,집안일은 없고 시간이 걸린다.
억울함,집안일 하고 못 흘려보냈어. 시간을 하나도
억울함,나는 집안일을 하지 않았고 시간을 보냈다.
억울함,오늘은 아무것도 하지 않고 침대에 누워 있었다.
억울함,하지 있었어. 누워 않고 아무것도 침대에만 오늘
억울함,오늘은 아무것도 하지 않고 침대에 누워있었습니다.
억울함,오늘 아무것도 하지 않고 침대에만 누워 있었어.
억울함,나는 내 친구에게 대답 할 수 없습니다.
억울함,친구한테 답장할 힘도 없었어.
억울함,없었어. 힘도 답장할 친구한테
억울함,친구에게 대답할 힘이 없었다.
억울함,나는 내 친구에게 대답할 수 없었다.
억울함,나는 하루 종일 방에서 침묵했다.
억울함,하루 방 있었어. 종일 안에서 조용히
억울함,방 안에서 하루 종일 조용했다.
억울함,하루 종일 방 안에서 조용히 있었어.
억울함,나는 하루 종일 방에서 조용했다.
억울함,나는 앉아서 지붕을 바라보는 시간을 보냈다.
억울함,나는 잠을 자고 천장을 쳐다보았다.
억울함,시간을 천장만 보냈어. 바라보며 누워서
억울함,누워서 천장만 바라보며 시간을 보냈어.
억울함,잠을 자고 지붕을 바라보며 시간을 보냈다.
좌절,"왜 이렇게 좌절하지, 나도 모르겠어."
좌절,"왜 그렇게 실망스러운지, 나는 알지 못한다."
좌절,왜 그렇게 우울한지 모르겠다.
좌절,왜 그렇게 실망했는지 모르겠다.
좌절,"모르겠어. 좌절하지, 이렇게 나도 왜"
좌절,"이 실망이 계속된다면, 그것은 떨어질 것이다."
좌절,이런 좌절이 계속되면 무너질 것 같아.
좌절,계속되면 좌절이 같아. 것 무너질 이런
좌절,이 혼란이 계속되면 붕괴될 것이다.
좌절,"이러한 혼란이 계속된다면, 그것은 붕괴 될 것입니다."
좌절,쌓여서 쌓이고 같아. 이제는 좌절이 것 무뎌진
좌절,지금은 실망하고 실망하다고 생각합니다.
좌절,실망이 쌓여 있고 지금은 헛된 것 같아요.
좌절,실망은 이미 축적되었고 이제는 사라진 것처럼 보입니다.
좌절,좌절이 쌓이고 쌓여서 이제는 무뎌진 것 같아.
좌절,일어나도 좌절은 자고 그대로야.
좌절,일어나서 잠을 자면 실망합니다.
좌절,잠을 자고 일어나는 것은 실망이다.
좌절,자고 일어나도 좌절은 그대로야.
좌절,잠을 자고 깨어나는 것은 실망스럽다.
좌절,"나는 울고있다, 어쩌면 실망 때문에."
좌절,"좌절 눈물만 때문일 아마 거야. 말없이 나,"
좌절,"말없이 눈물만 나, 아마 좌절 때문일 거야."
좌절,눈물을 흘리는 것은 아마도 절망의 원인일 것이다.
좌절,"내가 울었는데, 어쩌면 실망했을지도 모른다."
좌절,때로는 절망없이 살기를 원한다.
좌절,나는 때때로 실망없이 살고 싶다.
좌절,생각이 없이 들어. 싶다는 살고 가끔은 좌절
좌절,가끔은 좌절 없이 살고 싶다는 생각이 들어.
좌절,때때로 나는 실망하지 않고 살고 싶다고 느낀다.
좌절,종일 하루 느껴져서 계속 우울했어. 좌절이
좌절,나는 절망적이고 하루 종일 우울해졌다.
좌절,나는 하루 종일 혼란스럽고 우울했다.
좌절,나는 항상 실망하고 하루 종일 실망했다.
좌절,계속 좌절이 느껴져서 하루 종일 우울했어.
좌절,외부는 잘 보이지만 내면은 완전히 실망합니다.
좌절,그것은 좋은 것처럼 보이지만 완전히 실망스럽게 보입니다.
좌절,잘 보이지만 완전히 실망합니다.
좌절,겉으로는 멀쩡해 보여도 속은 완전 좌절이야.
좌절,좌절이야. 완전 멀쩡해 보여도 겉으로는 속은
좌절,"고통을 겪고, 아무 말도 하지 않는다."
좌절,나는 실망하고 아무 말도 하지 않는다.
좌절,싫어. 좌절이 괴로워서 아무 말도 하기
좌절,나는 고통스럽고 말을 하지 않는다.
좌절,좌절이 괴로워서 아무 말도 하기 싫어.
좌절,자꾸 좌절에 잠식당하는 기분이야.
좌절,그는 여전히 좌절감을 느낀다.
좌절,끊임없이 실망감을 느낀다.
좌절,끊임없이 실망합니다.
좌절,자꾸 좌절에 기분이야. 잠식당하는
좌절,"괜찮아, 나는 침몰했다고 느꼈다."
좌절,"그것은 일어나지 않지만, 나는 여전히 죽고있다."
좌절,기분이 없는데 자꾸 들어. 가라앉는 별일
좌절,별일 없는데 자꾸 가라앉는 기분이 들어.
좌절,아무것도 없지만 끊임없이 익사하는 것처럼 느껴집니다.
좌절,그것은 눈물의 날과 같았다.
좌절,그날은 마치 눈물을 흘리는 것처럼 보였다.
좌절,마치 눈물을 흘리는 날과 같았다.
좌절,날 하루였어. 같은 눈물이 괜히 것
좌절,괜히 눈물이 날 것 같은 하루였어.
좌절,집중하지 않고 어리석은
좌절,일상에 집중이 안 되고 멍했어.
좌절,집중하지 않는 것은 어리석은 일이다.
좌절,집중하지 말고 어리석다.
좌절,일상에 멍했어. 안 되고 집중이
좌절,마음이 복잡하고 어지러워.
좌절,당신의 마음은 복잡하고 복잡합니다.
좌절,마음이 어지러워. 복잡하고
좌절,마음은 복잡하고 혼란스럽다.
좌절,마음은 복잡하고 어리석은 것입니다.
좌절,쓸쓸함이 혼자 있으면 밀려와.
좌절,혼자 있으면 쓸쓸함이 밀려와.
좌절,"혼자있을 때, 불행을 제거하십시오."
좌절,혼자 있으면 쓸모가 없을 것이다.
좌절,"만약 당신이 혼자 있다면, 문제를 풀어주십시오."
좌절,아무 이유도 없고 아무 이유도 없다.
좌절,없이 힘들었어. 이유 지치고 그냥
좌절,그냥 이유 없이 지치고 힘들었어.
좌절,어렵고 피곤한 이유가 없었다.
좌절,이유 없이 피곤하고 힘들었다.
좌절,아무도 아무 말도 하지 않았지만 나는 바보였다.
좌절,아무도 말하지 않았지만 안전하게 대답했다.
좌절,"아무도 말하지 않았고, 나를 속였습니다."
좌절,누가 뭐라고 한 것도 아닌데 속이 답답했어.
좌절,답답했어. 한 속이 것도 아닌데 뭐라고 누가
좌절,하루 종일 기분이 좋지 않았다.
좌절,하루 종일 느껴지지 않았다.
좌절,하루 종일 기운이 없었어.
좌절,종일 없었어. 하루 기운이
좌절,왜 그런지 모르겠지만 힘들다.
좌절,"이러는지 왜 모르겠어, 내가 그냥 힘들어."
좌절,왜 그런지 모르겠지만 어렵다.
좌절,"왜 그런지 모르겠지만, 그게 어렵다."
좌절,"내가 왜 이러는지 모르겠어, 그냥 힘들어."
좌절,말을 할 때 마음이 텅 비어있다.
좌절,대화에도 마음이 텅 비어 있었다.
좌절,해도 마음이 공허했어. 대화를
좌절,대화를 해도 마음이 공허했어.
좌절,"내가 말했을 때, 내 마음은 텅 비어 있었다."
좌절,나는 앉아서 지붕을 바라보는 시간을 보냈다.
좌절,나는 잠을 자고 천장을 쳐다보았다.
좌절,누워서 천장만 바라보며 시간을 보냈어.
좌절,잠을 자고 지붕을 바라보며 시간을 보냈다.
좌절,누워서 천장만 바라보며 보냈어. 시간을
좌절,휴대폰을 보면서 시간을 보냈다.
좌절,핸드폰만 들여다보면서 시간을 보냈어.
좌절,나는 휴대폰을 보면서 시간을 보냈다.
좌절,들여다보면서 시간을 보냈어. 핸드폰만
좌절,하루 종일 창밖만 멍하니 바라봤어.
좌절,나는 하루 종일 창문 밖을 쳐다보았다.
좌절,나는 하루 종일 창문 밖을 바라보았다.
좌절,하루 종일 창문을 쳐다보았다.
좌절,나는 목욕조차 하지 않았다.
좌절,샤워할 기운조차 없었어.
좌절,샤워하는 느낌도 없었다.
좌절,나는 심지어 샤워를 하지 않았다.
좌절,없었어. 샤워할 기운조차
좌절,나는 내 친구에게 대답 할 수 없습니다.
좌절,힘도 없었어. 친구한테 답장할
좌절,친구한테 답장할 힘도 없었어.
좌절,친구에게 대답할 힘이 없었다.
좌절,나는 내 친구에게 대답할 수 없었다.
좌절,내 낯설게 속 느껴졌어. 모습이 거울
좌절,거울 속에서 보이는 것은 놀라운 모습이었다.
좌절,나는 거울 속에서 이상하게 보였다.
좌절,거울 속에서 이상하게 느껴졌다.
좌절,거울 속 내 모습이 낯설게 느껴졌어.
좌절,안에서 있었어. 종일 조용히 하루 방
좌절,나는 하루 종일 방에서 침묵했다.
좌절,방 안에서 하루 종일 조용했다.
좌절,하루 종일 방 안에서 조용히 있었어.
좌절,나는 하루 종일 방에서 조용했다.
좌절,오늘은 아무것도 하지 않고 침대에 누워 있었다.
좌절,있었어. 오늘 않고 침대에만 하지 아무것도 누워
좌절,오늘은 아무것도 하지 않고 침대에 누워있었습니다.
좌절,오늘 아무것도 하지 않고 침대에만 누워 있었어.
좌절,집안일 하나도 하고 못 시간을 흘려보냈어.
좌절,집안일 하나도 못 하고 시간을 흘려보냈어.
좌절,집안일도 없고 시간도 낭비했다.
좌절,집안일은 없고 시간이 걸린다.
좌절,나는 집안일을 하지 않았고 시간을 보냈다.
좌절,먹었는데 그냥 바보였어요.
좌절,나는 바보였고 그냥 바보였다.
좌절,"그냥 먹고, 그냥 어리석은 사람이다."
좌절,밥도 거르고 그냥 멍하니 있었어.
좌절,밥도 있었어. 그냥 거르고 멍하니
실망,"모르겠어. 이렇게 실망하지, 나도 왜"
실망,왜 그렇게 실망했는지 모르겠다.
실망,"나는 왜 그렇게 실망했는지, 나는 모른다."
실망,"왜 이렇게 실망하지, 나도 모르겠어."
실망,그냥 멍하게 있다 보면 실망이 밀려와.
실망,당신이 바보라면 당신은 실망할 것입니다.
실망,어리석은 것을 보면 실망을 추구한다.
실망,"당신이 바보라면, 당신은 실망합니다."
실망,실망이 그냥 보면 멍하게 밀려와. 있다
실망,나는 절망적이고 하루 종일 우울해졌다.
실망,계속 우울했어. 실망이 하루 종일 느껴져서
실망,계속 실망이 느껴져서 하루 종일 우울했어.
실망,나는 하루 종일 실망하고 우울했다.
실망,나는 항상 실망하고 하루 종일 실망했다.
실망,무슨 일이 있어도 실망은 좀처럼 사라지지 않아.
실망,무슨 일이 일어나든 실망은 사라지지 않는다.
실망,있어도 사라지지 않아. 일이 실망은 좀처럼 무슨
실망,말은 못 했지만 속으로는 계속 실망하고 있었어.
실망,실망하고 있었어. 했지만 속으로는 계속 못 말은
실망,"나는 말하지 않았다, 그러나 나는 여전히 실망했다."
실망,아무 말도 하지 않았지만 중간에 실망했다.
실망,나는 말을 하지 않았지만 내 안에서 실망했다.
실망,"그것은 실망의 날이었고, 특별한 것은 없었다."
실망,실망한 날에는 특별한 일이 없었다.
실망,"그냥 없는데. 실망한 특별한 일도 하루였어,"
실망,"그냥 실망한 하루였어, 특별한 일도 없는데."
실망,이것은 실망스러운 날이었고 특별한 일이 없었습니다.
실망,괜찮다고 말하면서도 계속 실망이 따라다녀.
실망,그는 괜찮다고 말하고 계속 실망한다.
실망,잘 말하지만 계속 실망합니다.
실망,계속 말하면서도 괜찮다고 따라다녀. 실망이
실망,성공한다고 하더라도 절망은 계속된다.
실망,때로는 실망없이 살기를 원한다.
실망,들어. 살고 가끔은 없이 실망 싶다는 생각이
실망,때때로 나는 실망하지 않는다고 느낀다.
실망,가끔은 실망 없이 살고 싶다는 생각이 들어.
실망,나는 때때로 실망없이 살고 싶다.
실망,실망이라는 감정을 이렇게 오래 느낀 건 처음이야.
실망,처음으로 그런 실망감을 느꼈다.
실망,감정을 건 이렇게 실망이라는 느낀 처음이야. 오래
실망,이렇게 오랫동안 실망감을 느끼는 것은 처음이다.
실망,이렇게 오랫동안 실망했던 것은 처음이다.
실망,나는 너무 실망해서 아무것도 할 수 없다.
실망,너무 실망해서 일할 수가 없습니다.
실망,실망이 너무 심해서 일도 못 하겠어.
실망,일도 너무 심해서 실망이 하겠어. 못
실망,"나는 실망하고, 할 수 없습니다."
실망,혼자 있으면 쓸쓸함이 밀려와.
실망,"혼자있을 때, 불행을 제거하십시오."
실망,쓸쓸함이 밀려와. 혼자 있으면
실망,혼자 있으면 쓸모가 없을 것이다.
실망,"만약 당신이 혼자 있다면, 문제를 풀어주십시오."
실망,마음이 복잡하고 어지러워.
실망,당신의 마음은 복잡하고 복잡합니다.
실망,어지러워. 복잡하고 마음이
실망,마음은 복잡하고 혼란스럽다.
실망,마음은 복잡하고 어리석은 것입니다.
실망,그것은 눈물의 날과 같았다.
실망,그날은 마치 눈물을 흘리는 것처럼 보였다.
실망,마치 눈물을 흘리는 날과 같았다.
실망,날 같은 하루였어. 것 눈물이 괜히
실망,괜히 눈물이 날 것 같은 하루였어.
실망,왜 그런지 모르겠지만 힘들다.
실망,왜 그런지 모르겠지만 어렵다.
실망,"왜 그런지 모르겠지만, 그게 어렵다."
실망,"모르겠어, 힘들어. 그냥 내가 왜 이러는지"
실망,"내가 왜 이러는지 모르겠어, 그냥 힘들어."
실망,아무도 아무 말도 하지 않았지만 나는 바보였다.
실망,아무도 말하지 않았지만 안전하게 대답했다.
실망,뭐라고 것도 한 아닌데 누가 답답했어. 속이
실망,"아무도 말하지 않았고, 나를 속였습니다."
실망,누가 뭐라고 한 것도 아닌데 속이 답답했어.
실망,"괜찮아, 나는 침몰했다고 느꼈다."
실망,들어. 없는데 가라앉는 별일 기분이 자꾸
실망,"그것은 일어나지 않지만, 나는 여전히 죽고있다."
실망,별일 없는데 자꾸 가라앉는 기분이 들어.
실망,아무것도 없지만 끊임없이 익사하는 것처럼 느껴집니다.
실망,아무 이유도 없고 아무 이유도 없다.
실망,그냥 이유 없이 지치고 힘들었어.
실망,어렵고 피곤한 이유가 없었다.
실망,이유 없이 피곤하고 힘들었다.
실망,그냥 이유 힘들었어. 없이 지치고
실망,하루 종일 기분이 좋지 않았다.
실망,하루 종일 느껴지지 않았다.
실망,하루 종일 기운이 없었어.
실망,하루 종일 없었어. 기운이
실망,말을 할 때 마음이 텅 비어있다.
실망,대화에도 마음이 텅 비어 있었다.
실망,해도 마음이 대화를 공허했어.
실망,대화를 해도 마음이 공허했어.
실망,"내가 말했을 때, 내 마음은 텅 비어 있었다."
실망,집중하지 않고 어리석은
실망,일상에 집중이 안 되고 멍했어.
실망,집중하지 않는 것은 어리석은 일이다.
실망,집중하지 말고 어리석다.
실망,집중이 멍했어. 되고 안 일상에
실망,나는 하루 종일 창문 밖을 쳐다보았다.
실망,나는 하루 종일 창문 밖을 바라보았다.
실망,하루 종일 창문을 쳐다보았다.
실망,창밖만 멍하니 종일 바라봤어. 하루
실망,하루 종일 창밖만 멍하니 바라봤어.
실망,집안일 하나도 못 하고 시간을 흘려보냈어.
실망,시간을 못 집안일 흘려보냈어. 하나도 하고
실망,집안일도 없고 시간도 낭비했다.
실망,집안일은 없고 시간이 걸린다.
실망,나는 집안일을 하지 않았고 시간을 보냈다.
실망,먹었는데 그냥 바보였어요.
실망,나는 바보였고 그냥 바보였다.
실망,"그냥 먹고, 그냥 어리석은 사람이다."
실망,밥도 거르고 그냥 멍하니 있었어.
실망,밥도 있었어. 멍하니 거르고 그냥
실망,나는 하루 종일 방에서 침묵했다.
실망,조용히 방 안에서 하루 있었어. 종일
실망,방 안에서 하루 종일 조용했다.
실망,하루 종일 방 안에서 조용히 있었어.
실망,나는 하루 종일 방에서 조용했다.
실망,휴대폰을 보면서 시간을 보냈다.
실망,핸드폰만 들여다보면서 시간을 보냈어.
실망,나는 휴대폰을 보면서 시간을 보냈다.
실망,시간을 보냈어. 들여다보면서 핸드폰만
실망,나는 목욕조차 하지 않았다.
실망,샤워할 기운조차 없었어.
실망,샤워할 없었어. 기운조차
실망,샤워하는 느낌도 없었다.
실망,나는 심지어 샤워를 하지 않았다.
실망,거울 느껴졌어. 내 속 모습이 낯설게
실망,거울 속에서 보이는 것은 놀라운 모습이었다.
실망,나는 거울 속에서 이상하게 보였다.
실망,거울 속에서 이상하게 느껴졌다.
실망,거울 속 내 모습이 낯설게 느껴졌어.
실망,나는 내 친구에게 대답 할 수 없습니다.
실망,나는 내 친구에게 대답할 수 없었다.
실망,친구에게 대답할 힘이 없었다.
실망,친구한테 답장할 힘도 없었어.
실망,오늘은 아무것도 하지 않고 침대에 누워 있었다.
실망,있었어. 않고 하지 오늘 아무것도 누워 침대에만
실망,오늘은 아무것도 하지 않고 침대에 누워있었습니다.
실망,오늘 아무것도 하지 않고 침대에만 누워 있었어.
실망,나는 앉아서 지붕을 바라보는 시간을 보냈다.
실망,나는 잠을 자고 천장을 쳐다보았다.
실망,보냈어. 누워서 바라보며 천장만 시간을
실망,누워서 천장만 바라보며 시간을 보냈어.
실망,잠을 자고 지붕을 바라보며 시간을 보냈다.
혐오,"사람들은 이해하지 못하고, 나는 정말 싫어한다."
혐오,나 모를 사람들이 혐오해. 진짜 뿐이지
혐오,사람들은 알지 못하지만 정말 싫어합니다.
혐오,사람들이 모를 뿐이지 나 진짜 혐오해.
혐오,"사람들은 모른다, 나는 정말로 그것을 싫어한다."
혐오,"증오는 고통스럽고, 나는 말하고 싶지 않다."
혐오,싫어. 괴로워서 혐오이 하기 말도 아무
혐오,나는 싫어하고 아무 말도 하지 않는다.
혐오,"나는 증오를 받았고, 아무 말도 하지 않았다."
혐오,혐오이 괴로워서 아무 말도 하기 싫어.
혐오,심해서 일도 혐오이 너무 못 하겠어.
혐오,혐오이 너무 심해서 일도 못 하겠어.
혐오,혐오가 너무 많아서 일할 수가 없습니다.
혐오,증오는 너무 힘들어서 할 수가 없어요.
혐오,증오가 너무 많아서 할 수 없습니다.
혐오,미움 때문에 웃는 것은 이상하다.
혐오,때문에 게 혐오 웃는 어색해졌어.
혐오,혐오 때문에 웃는 게 어색해졌어.
혐오,미움으로 웃는 것은 놀라운 일이다.
혐오,미움 때문에 웃는 것은 이상한 일이었다.
혐오,나는 사람들을 만나는 것을 너무 싫어한다.
혐오,나는 사람을 너무 싫어하고 사람을 만나는 것을 싫어한다.
혐오,혐오이 너무 심해서 사람 만나기도 싫어.
혐오,혐오가 너무 커서 다른 사람을 보는 것을 좋아하지 않는다.
혐오,혐오이 너무 사람 싫어. 심해서 만나기도
혐오,무슨 일이 일어나든 증오는 사라지지 않는다.
혐오,"무슨 일이 일어나든, 증오는 사라지지 않는다."
혐오,무슨 일이 있어도 혐오은 좀처럼 사라지지 않아.
혐오,혐오은 좀처럼 일이 무슨 않아. 사라지지 있어도
혐오,"솔직히 말하자면, 나는 지금 증오 때문에 힘들다."
혐오,"진실로 말하자면, 나는 지금 증오로 인해 힘들다."
혐오,"솔직히 말하자면, 나는 지금 증오를 위해 노력하고 있습니다."
혐오,나 힘들어. 솔직히 말해서 혐오 때문에 지금
혐오,솔직히 말해서 나 지금 혐오 때문에 힘들어.
혐오,내 혐오이 전부를 있어. 일상 잠식하고
혐오,혐오이 내 일상 전부를 잠식하고 있어.
혐오,증오는 내 인생 전체를 좁히고 있다.
혐오,나의 증오는 나의 모든 날을 덮고 있다.
혐오,나의 증오는 나의 모든 것을 깨뜨렸다.
혐오,괜찮다고 말하면서도 계속 혐오이 따라다녀.
혐오,그는 괜찮다고 말하지만 계속해서 싫어한다.
혐오,혐오이 말하면서도 계속 따라다녀. 괜찮다고
혐오,"잘 말하지만, 항상 증오를 따릅니다."
혐오,"잘 말하면, 증오는 계속됩니다."
혐오,증오 때문에 먹거나 잠을 자지 않는다.
혐오,왜냐하면 증오도 없고 음식도 없고 잠도 없기 때문이다.
혐오,혐오 때문에 밥맛도 없고 잠도 안 와.
혐오,증오 때문에 음식이나 잠이 없습니다.
혐오,안 혐오 잠도 와. 밥맛도 없고 때문에
혐오,하루 종일 기분이 좋지 않았다.
혐오,하루 종일 느껴지지 않았다.
혐오,하루 종일 기운이 없었어.
혐오,기운이 종일 없었어. 하루
혐오,왜 그런지 모르겠지만 힘들다.
혐오,왜 그런지 모르겠지만 어렵다.
혐오,"왜 그런지 모르겠지만, 그게 어렵다."
혐오,"내가 왜 이러는지 모르겠어, 그냥 힘들어."
혐오,"내가 그냥 힘들어. 모르겠어, 왜 이러는지"
혐오,아무도 아무 말도 하지 않았지만 나는 바보였다.
혐오,아무도 말하지 않았지만 안전하게 대답했다.
혐오,누가 아닌데 답답했어. 한 것도 속이 뭐라고
혐오,"아무도 말하지 않았고, 나를 속였습니다."
혐오,누가 뭐라고 한 것도 아닌데 속이 답답했어.
혐오,혼자 있으면 쓸쓸함이 밀려와.
혐오,"혼자있을 때, 불행을 제거하십시오."
혐오,혼자 있으면 쓸모가 없을 것이다.
혐오,있으면 쓸쓸함이 혼자 밀려와.
혐오,"만약 당신이 혼자 있다면, 문제를 풀어주십시오."
혐오,아무 이유도 없고 아무 이유도 없다.
혐오,그냥 이유 없이 지치고 힘들었어.
혐오,힘들었어. 없이 이유 그냥 지치고
혐오,어렵고 피곤한 이유가 없었다.
혐오,이유 없이 피곤하고 힘들었다.
혐오,말을 할 때 마음이 텅 비어있다.
혐오,대화에도 마음이 텅 비어 있었다.
혐오,대화를 해도 마음이 공허했어.
혐오,"내가 말했을 때, 내 마음은 텅 비어 있었다."
혐오,공허했어. 대화를 마음이 해도
혐오,마음이 복잡하고 어지러워.
혐오,당신의 마음은 복잡하고 복잡합니다.
혐오,마음이 어지러워. 복잡하고
혐오,마음은 복잡하고 혼란스럽다.
혐오,마음은 복잡하고 어리석은 것입니다.
혐오,그것은 눈물의 날과 같았다.
혐오,하루였어. 같은 괜히 것 날 눈물이
혐오,그날은 마치 눈물을 흘리는 것처럼 보였다.
혐오,마치 눈물을 흘리는 날과 같았다.
혐오,괜히 눈물이 날 것 같은 하루였어.
혐오,"괜찮아, 나는 침몰했다고 느꼈다."
혐오,"그것은 일어나지 않지만, 나는 여전히 죽고있다."
혐오,가라앉는 별일 기분이 들어. 없는데 자꾸
혐오,별일 없는데 자꾸 가라앉는 기분이 들어.
혐오,아무것도 없지만 끊임없이 익사하는 것처럼 느껴집니다.
혐오,집중하지 않고 어리석은
혐오,일상에 집중이 안 되고 멍했어.
혐오,집중하지 않는 것은 어리석은 일이다.
혐오,집중하지 말고 어리석다.
혐오,일상에 멍했어. 안 되고 집중이
혐오,나는 앉아서 지붕을 바라보는 시간을 보냈다.
혐오,누워서 천장만 바라보며 시간을 보냈어.
혐오,나는 잠을 자고 천장을 쳐다보았다.
혐오,누워서 보냈어. 천장만 시간을 바라보며
혐오,잠을 자고 지붕을 바라보며 시간을 보냈다.
혐오,나는 내 친구에게 대답 할 수 없습니다.
혐오,힘도 없었어. 친구한테 답장할
혐오,친구한테 답장할 힘도 없었어.
혐오,친구에게 대답할 힘이 없었다.
혐오,나는 내 친구에게 대답할 수 없었다.
혐오,휴대폰을 보면서 시간을 보냈다.
혐오,핸드폰만 들여다보면서 시간을 보냈어.
혐오,보냈어. 핸드폰만 들여다보면서 시간을
혐오,나는 휴대폰을 보면서 시간을 보냈다.
혐오,나는 목욕조차 하지 않았다.
혐오,샤워할 기운조차 없었어.
혐오,기운조차 샤워할 없었어.
혐오,샤워하는 느낌도 없었다.
혐오,나는 심지어 샤워를 하지 않았다.
혐오,오늘은 아무것도 하지 않고 침대에 누워 있었다.
혐오,아무것도 않고 누워 침대에만 하지 오늘 있었어.
혐오,오늘은 아무것도 하지 않고 침대에 누워있었습니다.
혐오,오늘 아무것도 하지 않고 침대에만 누워 있었어.
혐오,먹었는데 그냥 바보였어요.
혐오,나는 바보였고 그냥 바보였다.
혐오,"그냥 먹고, 그냥 어리석은 사람이다."
혐오,거르고 멍하니 있었어. 그냥 밥도
혐오,밥도 거르고 그냥 멍하니 있었어.
혐오,거울 속에서 보이는 것은 놀라운 모습이었다.
혐오,낯설게 내 느껴졌어. 속 거울 모습이
혐오,나는 거울 속에서 이상하게 보였다.
혐오,거울 속에서 이상하게 느껴졌다.
혐오,거울 속 내 모습이 낯설게 느껴졌어.
혐오,안에서 종일 조용히 방 있었어. 하루
혐오,나는 하루 종일 방에서 침묵했다.
혐오,방 안에서 하루 종일 조용했다.
혐오,하루 종일 방 안에서 조용히 있었어.
혐오,나는 하루 종일 방에서 조용했다.
