감정명,문장 예시
혼동,"내가 말했을 때, 내 마음은 텅 비어 있었다."
혼동,공허했어. 마음이 대화를 해도
혼동,집중하지 않고 어리석은
혼동,일상에 집중이 안 되고 멍했어.
혼동,집중하지 않는 것은 어리석은 일이다.
혼동,집중하지 말고 어리석다.
혼동,집중이 안 멍했어. 일상에 되고
혼동,당신의 마음은 복잡하고 복잡합니다.
혼동,마음은 복잡하고 혼란스럽다.
혼동,마음은 복잡하고 어리석은 것입니다.
혼동,마음이 복잡하고 어지러워.
혼동,그것은 눈물의 날과 같았다.
혼동,그날은 마치 눈물을 흘리는 것처럼 보였다.
혼동,마치 눈물을 흘리는 날과 같았다.
혼동,눈물이 같은 날 괜히 것 하루였어.
혼동,괜히 눈물이 날 것 같은 하루였어.
혼동,혼자 밀려와. 쓸쓸함이 있으면
혼동,혼자 있으면 쓸쓸함이 밀려와.
혼동,"혼자있을 때, 불행을 제거하십시오."
혼동,혼자 있으면 쓸모가 없을 것이다.
혼동,"만약 당신이 혼자 있다면, 문제를 풀어주십시오."
혼동,집안일 하나도 못 하고 시간을 흘려보냈어.
혼동,집안일도 없고 시간도 낭비했다.
혼동,집안일은 없고 시간이 걸린다.
혼동,시간을 하나도 흘려보냈어. 집안일 하고 못
혼동,나는 집안일을 하지 않았고 시간을 보냈다.
혼동,나는 하루 종일 창문 밖을 쳐다보았다.
혼동,나는 하루 종일 창문 밖을 바라보았다.
혼동,하루 종일 창문을 쳐다보았다.
혼동,바라봤어. 창밖만 종일 멍하니 하루
혼동,하루 종일 창밖만 멍하니 바라봤어.
혼동,휴대폰을 보면서 시간을 보냈다.
혼동,핸드폰만 들여다보면서 시간을 보냈어.
혼동,나는 휴대폰을 보면서 시간을 보냈다.
혼동,들여다보면서 시간을 보냈어. 핸드폰만
혼동,오늘은 아무것도 하지 않고 침대에 누워 있었다.
혼동,누워 있었어. 않고 아무것도 침대에만 오늘 하지
혼동,오늘은 아무것도 하지 않고 침대에 누워있었습니다.
혼동,오늘 아무것도 하지 않고 침대에만 누워 있었어.
혼동,거울 속에서 보이는 것은 놀라운 모습이었다.
혼동,나는 거울 속에서 이상하게 보였다.
혼동,거울 느껴졌어. 낯설게 내 속 모습이
혼동,거울 속에서 이상하게 느껴졌다.
혼동,거울 속 내 모습이 낯설게 느껴졌어.
혼동,나는 목욕조차 하지 않았다.
혼동,샤워할 기운조차 없었어.
혼동,샤워하는 느낌도 없었다.
혼동,나는 심지어 샤워를 하지 않았다.
혼동,기운조차 없었어. 샤워할
혼동,나는 앉아서 지붕을 바라보는 시간을 보냈다.
혼동,보냈어. 천장만 시간을 누워서 바라보며
혼동,나는 잠을 자고 천장을 쳐다보았다.
혼동,누워서 천장만 바라보며 시간을 보냈어.
혼동,잠을 자고 지붕을 바라보며 시간을 보냈다.
혼동,나는 내 친구에게 대답 할 수 없습니다.
혼동,친구한테 답장할 힘도 없었어.
혼동,친구한테 답장할 없었어. 힘도
혼동,친구에게 대답할 힘이 없었다.
혼동,나는 내 친구에게 대답할 수 없었다.
혼동,나는 하루 종일 방에서 침묵했다.
혼동,있었어. 하루 조용히 종일 방 안에서
혼동,방 안에서 하루 종일 조용했다.
혼동,하루 종일 방 안에서 조용히 있었어.
혼동,나는 하루 종일 방에서 조용했다.
혼동,먹었는데 그냥 바보였어요.
혼동,나는 바보였고 그냥 바보였다.
혼동,"그냥 먹고, 그냥 어리석은 사람이다."
혼동,밥도 거르고 그냥 멍하니 있었어.
혼동,있었어. 거르고 그냥 밥도 멍하니
감정과부하,나의 기분은 너무 나쁘고 나는 다른 사람을 만나고 싶지 않다.
감정과부하,나는 너무 감정적이어서 사람들을 만나는 것을 좋아하지 않는다.
감정과부하,싫어. 만나기도 너무 심해서 감정과부하이 사람
감정과부하,감정과부하이 너무 심해서 사람 만나기도 싫어.
감정과부하,감정이 너무 힘들어서 사람을 만나고 싶지 않다.
감정과부하,하루 종일 감정에 휩싸였습니다.
감정과부하,나는 하루 종일 감정에 대해 생각한다.
감정과부하,하루 종일 감정과부하 생각뿐이었어.
감정과부하,나는 하루 종일 감정에 대해 생각했다.
감정과부하,생각뿐이었어. 하루 종일 감정과부하
감정과부하,당신이 바보라면 감정을 밀어 넣으십시오.
감정과부하,"당신이 어리석은 경우에, 감정을 밀어 넣으십시오."
감정과부하,어리석음을 보면 감정을 밀어 넣는다.
감정과부하,그냥 멍하게 있다 보면 감정과부하이 밀려와.
감정과부하,밀려와. 감정과부하이 그냥 멍하게 보면 있다
감정과부하,"아마 감정과부하 말없이 나, 때문일 거야. 눈물만"
감정과부하,눈물을 흘리는 것은 아마 감정 때문일 것이다.
감정과부하,나의 눈물은 아마도 나의 감정 때문일 것이다.
감정과부하,"나는 울고있다, 아마도 내 감정 때문에."
감정과부하,"말없이 눈물만 나, 아마 감정과부하 때문일 거야."
감정과부하,속은 겉으로는 보여도 완전 멀쩡해 감정과부하이야.
감정과부하,그것은 잘 보이지만 내부는 완전히 감정으로 가득합니다.
감정과부하,외부는 아름답지만 내면은 감정으로 가득합니다.
감정과부하,겉으로는 멀쩡해 보여도 속은 완전 감정과부하이야.
감정과부하,"그것은 좋은 것처럼 보이지만, 그것은 완전히 감정적입니다."
감정과부하,감정 때문에 웃는 것은 이상하다.
감정과부하,감정과부하 때문에 웃는 게 어색해졌어.
감정과부하,감정 때문에 웃는 것이 이상했습니다.
감정과부하,감정 때문에 웃는 것은 놀라운 일이다.
감정과부하,웃는 게 감정과부하 때문에 어색해졌어.
감정과부하,"사람들은 모른다, 나는 정말로 느낀다."
감정과부하,"사람들은 이해하지 못했고, 나는 정말로 흥분했다."
감정과부하,사람은 알지 못하지만 진정한 느낌입니다.
감정과부하,뿐이지 모를 나 진짜 감정과부하해. 사람들이
감정과부하,사람들이 모를 뿐이지 나 진짜 감정과부하해.
감정과부하,오늘날 진정한 감정 때문에 아무것도 얻을 수 없습니다.
감정과부하,감정과부하 안 잡혀. 손에 요즘 진짜 아무것도 때문에
감정과부하,"오늘날, 진정한 감정 때문에 아무것도 손에 들지 않습니다."
감정과부하,요즘 진짜 감정과부하 때문에 아무것도 손에 안 잡혀.
감정과부하,"오늘날, 진정한 감정 때문에, 아무것도 손에 없습니다."
감정과부하,나 요즘 감정과부하이 너무 심해서 병원 가볼까 고민 중이야.
감정과부하,나는 최근에 화가 나서 병원에 가고 싶었다.
감정과부하,가볼까 너무 병원 고민 감정과부하이 중이야. 나 요즘 심해서
감정과부하,최근에는 고통이 너무 심해 병원에 가는 것이 어렵습니다.
감정과부하,"나는 너무 민감하다, 나는 병원에 갈 것이다."
감정과부하,감정이 고통스럽고 아무 말도 하지 않는다.
감정과부하,감정과부하이 괴로워서 아무 말도 하기 싫어.
감정과부하,나는 고통을 겪고 아무 말도 하지 않는다.
감정과부하,하기 괴로워서 말도 아무 싫어. 감정과부하이
감정과부하,나는 고통스럽고 말을 하지 않는다.
감정과부하,아무 이유도 없고 아무 이유도 없다.
감정과부하,그냥 이유 없이 지치고 힘들었어.
감정과부하,어렵고 피곤한 이유가 없었다.
감정과부하,그냥 지치고 힘들었어. 이유 없이
감정과부하,이유 없이 피곤하고 힘들었다.
감정과부하,그것은 눈물의 날과 같았다.
감정과부하,같은 것 눈물이 날 괜히 하루였어.
감정과부하,그날은 마치 눈물을 흘리는 것처럼 보였다.
감정과부하,마치 눈물을 흘리는 날과 같았다.
감정과부하,괜히 눈물이 날 것 같은 하루였어.
감정과부하,일상에 집중이 되고 멍했어. 안
감정과부하,집중하지 않고 어리석은
감정과부하,일상에 집중이 안 되고 멍했어.
감정과부하,집중하지 않는 것은 어리석은 일이다.
감정과부하,집중하지 말고 어리석다.
감정과부하,왜 그런지 모르겠지만 힘들다.
감정과부하,왜 그런지 모르겠지만 어렵다.
감정과부하,"왜 그런지 모르겠지만, 그게 어렵다."
감정과부하,"내가 왜 이러는지 모르겠어, 그냥 힘들어."
감정과부하,"힘들어. 왜 모르겠어, 그냥 이러는지 내가"
감정과부하,말을 할 때 마음이 텅 비어있다.
감정과부하,대화에도 마음이 텅 비어 있었다.
감정과부하,대화를 해도 마음이 공허했어.
감정과부하,"내가 말했을 때, 내 마음은 텅 비어 있었다."
감정과부하,공허했어. 마음이 해도 대화를
감정과부하,복잡하고 어지러워. 마음이
감정과부하,마음이 복잡하고 어지러워.
감정과부하,당신의 마음은 복잡하고 복잡합니다.
감정과부하,마음은 복잡하고 혼란스럽다.
감정과부하,마음은 복잡하고 어리석은 것입니다.
감정과부하,아무도 아무 말도 하지 않았지만 나는 바보였다.
감정과부하,아무도 말하지 않았지만 안전하게 대답했다.
감정과부하,답답했어. 아닌데 한 누가 것도 뭐라고 속이
감정과부하,"아무도 말하지 않았고, 나를 속였습니다."
감정과부하,누가 뭐라고 한 것도 아닌데 속이 답답했어.
감정과부하,하루 종일 기분이 좋지 않았다.
감정과부하,하루 종일 느껴지지 않았다.
감정과부하,하루 종일 기운이 없었어.
감정과부하,종일 없었어. 하루 기운이
감정과부하,혼자 있으면 쓸쓸함이 밀려와.
감정과부하,"혼자있을 때, 불행을 제거하십시오."
감정과부하,밀려와. 있으면 혼자 쓸쓸함이
감정과부하,혼자 있으면 쓸모가 없을 것이다.
감정과부하,"만약 당신이 혼자 있다면, 문제를 풀어주십시오."
감정과부하,"괜찮아, 나는 침몰했다고 느꼈다."
감정과부하,"그것은 일어나지 않지만, 나는 여전히 죽고있다."
감정과부하,별일 가라앉는 없는데 들어. 기분이 자꾸
감정과부하,별일 없는데 자꾸 가라앉는 기분이 들어.
감정과부하,아무것도 없지만 끊임없이 익사하는 것처럼 느껴집니다.
감정과부하,바라보며 누워서 보냈어. 시간을 천장만
감정과부하,나는 앉아서 지붕을 바라보는 시간을 보냈다.
감정과부하,나는 잠을 자고 천장을 쳐다보았다.
감정과부하,누워서 천장만 바라보며 시간을 보냈어.
감정과부하,잠을 자고 지붕을 바라보며 시간을 보냈다.
감정과부하,집안일 하나도 하고 시간을 못 흘려보냈어.
감정과부하,집안일 하나도 못 하고 시간을 흘려보냈어.
감정과부하,집안일도 없고 시간도 낭비했다.
감정과부하,집안일은 없고 시간이 걸린다.
감정과부하,나는 집안일을 하지 않았고 시간을 보냈다.
감정과부하,나는 목욕조차 하지 않았다.
감정과부하,샤워할 기운조차 없었어.
감정과부하,샤워할 없었어. 기운조차
감정과부하,샤워하는 느낌도 없었다.
감정과부하,나는 심지어 샤워를 하지 않았다.
감정과부하,나는 내 친구에게 대답 할 수 없습니다.
감정과부하,친구한테 답장할 힘도 없었어.
감정과부하,친구에게 대답할 힘이 없었다.
감정과부하,답장할 없었어. 힘도 친구한테
감정과부하,나는 내 친구에게 대답할 수 없었다.
감정과부하,오늘은 아무것도 하지 않고 침대에 누워 있었다.
감정과부하,오늘은 아무것도 하지 않고 침대에 누워있었습니다.
감정과부하,침대에만 있었어. 오늘 하지 아무것도 않고 누워
감정과부하,오늘 아무것도 하지 않고 침대에만 누워 있었어.
감정과부하,먹었는데 그냥 바보였어요.
감정과부하,있었어. 멍하니 그냥 거르고 밥도
감정과부하,나는 바보였고 그냥 바보였다.
감정과부하,"그냥 먹고, 그냥 어리석은 사람이다."
감정과부하,밥도 거르고 그냥 멍하니 있었어.
감정과부하,거울 속에서 보이는 것은 놀라운 모습이었다.
감정과부하,나는 거울 속에서 이상하게 보였다.
감정과부하,거울 모습이 낯설게 느껴졌어. 속 내
감정과부하,거울 속에서 이상하게 느껴졌다.
감정과부하,거울 속 내 모습이 낯설게 느껴졌어.
감정과부하,나는 하루 종일 창문 밖을 쳐다보았다.
감정과부하,나는 하루 종일 창문 밖을 바라보았다.
감정과부하,하루 종일 창문을 쳐다보았다.
감정과부하,하루 종일 창밖만 멍하니 바라봤어.
감정과부하,종일 창밖만 하루 바라봤어. 멍하니
감정과부하,나는 하루 종일 방에서 침묵했다.
감정과부하,조용히 있었어. 종일 하루 방 안에서
감정과부하,방 안에서 하루 종일 조용했다.
감정과부하,하루 종일 방 안에서 조용히 있었어.
감정과부하,나는 하루 종일 방에서 조용했다.
감정과부하,휴대폰을 보면서 시간을 보냈다.
감정과부하,핸드폰만 들여다보면서 시간을 보냈어.
감정과부하,핸드폰만 시간을 들여다보면서 보냈어.
감정과부하,나는 휴대폰을 보면서 시간을 보냈다.
감정억제,나는 말을 하지 않았지만 내면에 흥분을 느꼈다.
감정억제,말은 못 계속 감정억제하고 속으로는 있었어. 했지만
감정억제,말은 못 했지만 속으로는 계속 감정억제하고 있었어.
감정억제,아무 말도 하지 않았지만 내부에서 감동이 계속되었습니다.
감정억제,"나는 말하지 않았다, 그러나 나는 여전히 느꼈다."
감정억제,"솔직히 말하자면, 나는 감정 때문에 지금 힘들다."
감정억제,감정억제 나 솔직히 말해서 지금 힘들어. 때문에
감정억제,"솔직히 말하자면, 지금은 감정이 좋지 않다."
감정억제,솔직히 말해서 나 지금 감정억제 때문에 힘들어.
감정억제,"솔직히 말하자면, 나는 지금 감정적 인 억제로 인해 어려움을 겪고 있습니다."
감정억제,감정을 어떻게 표현할지 모르겠다.
감정억제,감정을 어떻게 모르겠어. 할지 감정억제이라는 표현해야
감정억제,감정억제이라는 감정을 어떻게 표현해야 할지 모르겠어.
감정억제,나는 감정을 표현하는 방법을 모른다.
감정억제,계속 감정억제이 느껴져서 하루 종일 우울했어.
감정억제,나는 하루 종일 우울하고 우울하다고 느꼈다.
감정억제,나는 곤경에 빠졌고 하루 종일 곤경에 빠졌다.
감정억제,우울했어. 계속 종일 느껴져서 하루 감정억제이
감정억제,나는 항상 우울하고 하루 종일 실망했다.
감정억제,오늘 나는 화가 나서 병원에 가고 싶다.
감정억제,너무 고민 나 가볼까 심해서 요즘 감정억제이 병원 중이야.
감정억제,"나는 너무 민감하다, 나는 병원에 갈 것이다."
감정억제,나는 최근에 질병을 앓고 있으므로 병원에 가고 싶다.
감정억제,나 요즘 감정억제이 너무 심해서 병원 가볼까 고민 중이야.
감정억제,이렇게 오랫동안 감정적 인 억제감을 느끼는 것은 처음이었습니다.
감정억제,감정억제이라는 감정을 이렇게 오래 처음이야. 건 느낀
감정억제,이렇게 오랫동안 감정을 느끼는 것은 처음이다.
감정억제,이렇게 오랫동안 그런 느낌을 느끼는 것은 처음이었습니다.
감정억제,감정억제이라는 감정을 이렇게 오래 느낀 건 처음이야.
감정억제,때문에 게 웃는 감정억제 어색해졌어.
감정억제,감정억제 때문에 웃는 게 어색해졌어.
감정억제,감정 때문에 웃는 것이 이상했습니다.
감정억제,감정 때문에 웃는 것은 놀라운 일이다.
감정억제,감정 때문에 웃는 것은 이상하다.
감정억제,감정억제이 너무 심해서 일도 못 하겠어.
감정억제,감정은 너무 힘들어서 일할 수 없습니다.
감정억제,심해서 못 너무 하겠어. 일도 감정억제이
감정억제,"나의 감정은 너무 크고, 나는 할 수 없다."
감정억제,감정이 너무 무거워서 일을 할 수 없습니다.
감정억제,감정은 깨졌고 이제는 사라진 것처럼 보입니다.
감정억제,감정억제이 쌓이고 쌓여서 이제는 무뎌진 것 같아.
감정억제,"감정은 과장되고 있으며, 이제는 과장 된 것처럼 보입니다."
감정억제,감정이 쌓여있어서 지금은 헛된 것 같아요.
감정억제,쌓이고 쌓여서 같아. 이제는 감정억제이 무뎌진 것
감정억제,이러한 감정이 계속되면 그것은 붕괴됩니다.
감정억제,"이러한 감정이 계속되면, 그들은 떨어질 것입니다."
감정억제,이런 감정억제이 계속되면 무너질 것 같아.
감정억제,무너질 감정억제이 계속되면 이런 같아. 것
감정억제,이런 감정이 계속되면 붕괴될 것 같습니다.
감정억제,"괜찮아, 나는 침몰했다고 느꼈다."
감정억제,"그것은 일어나지 않지만, 나는 여전히 죽고있다."
감정억제,별일 없는데 자꾸 가라앉는 기분이 들어.
감정억제,없는데 들어. 가라앉는 별일 자꾸 기분이
감정억제,아무것도 없지만 끊임없이 익사하는 것처럼 느껴집니다.
감정억제,말을 할 때 마음이 텅 비어있다.
감정억제,대화에도 마음이 텅 비어 있었다.
감정억제,해도 마음이 대화를 공허했어.
감정억제,대화를 해도 마음이 공허했어.
감정억제,"내가 말했을 때, 내 마음은 텅 비어 있었다."
감정억제,집중하지 않고 어리석은
감정억제,일상에 집중이 안 되고 멍했어.
감정억제,안 집중이 일상에 되고 멍했어.
감정억제,집중하지 않는 것은 어리석은 일이다.
감정억제,집중하지 말고 어리석다.
감정억제,왜 그런지 모르겠지만 힘들다.
감정억제,왜 그런지 모르겠지만 어렵다.
감정억제,"모르겠어, 이러는지 힘들어. 왜 내가 그냥"
감정억제,"왜 그런지 모르겠지만, 그게 어렵다."
감정억제,"내가 왜 이러는지 모르겠어, 그냥 힘들어."
감정억제,어지러워. 마음이 복잡하고
감정억제,마음이 복잡하고 어지러워.
감정억제,당신의 마음은 복잡하고 복잡합니다.
감정억제,마음은 복잡하고 혼란스럽다.
감정억제,마음은 복잡하고 어리석은 것입니다.
감정억제,아무 이유도 없고 아무 이유도 없다.
감정억제,그냥 이유 없이 지치고 힘들었어.
감정억제,힘들었어. 그냥 없이 이유 지치고
감정억제,어렵고 피곤한 이유가 없었다.
감정억제,이유 없이 피곤하고 힘들었다.
감정억제,아무도 아무 말도 하지 않았지만 나는 바보였다.
감정억제,아무도 말하지 않았지만 안전하게 대답했다.
감정억제,뭐라고 누가 답답했어. 것도 속이 한 아닌데
감정억제,"아무도 말하지 않았고, 나를 속였습니다."
감정억제,누가 뭐라고 한 것도 아닌데 속이 답답했어.
감정억제,그것은 눈물의 날과 같았다.
감정억제,그날은 마치 눈물을 흘리는 것처럼 보였다.
감정억제,마치 눈물을 흘리는 날과 같았다.
감정억제,괜히 눈물이 날 것 같은 하루였어.
감정억제,하루였어. 것 날 눈물이 같은 괜히
감정억제,혼자 있으면 쓸쓸함이 밀려와.
감정억제,쓸쓸함이 있으면 밀려와. 혼자
감정억제,"혼자있을 때, 불행을 제거하십시오."
감정억제,혼자 있으면 쓸모가 없을 것이다.
감정억제,"만약 당신이 혼자 있다면, 문제를 풀어주십시오."
감정억제,하루 종일 기분이 좋지 않았다.
감정억제,하루 종일 느껴지지 않았다.
감정억제,하루 종일 기운이 없었어.
감정억제,기운이 종일 없었어. 하루
감정억제,나는 내 친구에게 대답 할 수 없습니다.
감정억제,친구한테 답장할 힘도 없었어.
감정억제,친구한테 없었어. 힘도 답장할
감정억제,친구에게 대답할 힘이 없었다.
감정억제,나는 내 친구에게 대답할 수 없었다.
감정억제,나는 목욕조차 하지 않았다.
감정억제,샤워할 기운조차 없었어.
감정억제,샤워하는 느낌도 없었다.
감정억제,나는 심지어 샤워를 하지 않았다.
감정억제,없었어. 샤워할 기운조차
감정억제,집안일 하나도 못 하고 시간을 흘려보냈어.
감정억제,집안일도 없고 시간도 낭비했다.
감정억제,집안일은 없고 시간이 걸린다.
감정억제,집안일 하나도 시간을 하고 못 흘려보냈어.
감정억제,나는 집안일을 하지 않았고 시간을 보냈다.
감정억제,먹었는데 그냥 바보였어요.
감정억제,거르고 밥도 그냥 있었어. 멍하니
감정억제,나는 바보였고 그냥 바보였다.
감정억제,"그냥 먹고, 그냥 어리석은 사람이다."
감정억제,밥도 거르고 그냥 멍하니 있었어.
감정억제,나는 앉아서 지붕을 바라보는 시간을 보냈다.
감정억제,천장만 누워서 바라보며 보냈어. 시간을
감정억제,나는 잠을 자고 천장을 쳐다보았다.
감정억제,누워서 천장만 바라보며 시간을 보냈어.
감정억제,잠을 자고 지붕을 바라보며 시간을 보냈다.
감정억제,거울 속에서 보이는 것은 놀라운 모습이었다.
감정억제,나는 거울 속에서 이상하게 보였다.
감정억제,거울 속 모습이 내 느껴졌어. 낯설게
감정억제,거울 속에서 이상하게 느껴졌다.
감정억제,거울 속 내 모습이 낯설게 느껴졌어.
감정억제,나는 하루 종일 방에서 침묵했다.
감정억제,종일 조용히 하루 방 안에서 있었어.
감정억제,방 안에서 하루 종일 조용했다.
감정억제,하루 종일 방 안에서 조용히 있었어.
감정억제,나는 하루 종일 방에서 조용했다.
감정억제,나는 하루 종일 창문 밖을 쳐다보았다.
감정억제,나는 하루 종일 창문 밖을 바라보았다.
감정억제,하루 종일 창문을 쳐다보았다.
감정억제,하루 멍하니 바라봤어. 종일 창밖만
감정억제,하루 종일 창밖만 멍하니 바라봤어.
감정억제,휴대폰을 보면서 시간을 보냈다.
감정억제,핸드폰만 들여다보면서 시간을 보냈어.
감정억제,핸드폰만 보냈어. 시간을 들여다보면서
감정억제,나는 휴대폰을 보면서 시간을 보냈다.
감정억제,오늘은 아무것도 하지 않고 침대에 누워 있었다.
감정억제,하지 오늘 침대에만 있었어. 아무것도 누워 않고
감정억제,오늘은 아무것도 하지 않고 침대에 누워있었습니다.
감정억제,오늘 아무것도 하지 않고 침대에만 누워 있었어.
피하고 싶음,"무슨 일이 일어나든, 피하려는 욕망은 사라지지 않는다."
피하고 싶음,무슨 일이 있어도 피하고 싶음은 좀처럼 사라지지 않아.
피하고 싶음,무슨 일이 일어나든지 피하려는 것은 조금씩 사라지지 않는다.
피하고 싶음,무슨 일이 일어나든 도망치려는 욕망은 사라지지 않는다.
피하고 싶음,있어도 좀처럼 무슨 않아. 싶음은 사라지지 일이 피하고
피하고 싶음,나는 내 인생 전체를 피하고 싶다.
피하고 싶음,피하고 싶다는 것은 나의 모든 날을 닫고 있다.
피하고 싶음,피하고 싶음이 내 일상 전부를 잠식하고 있어.
피하고 싶음,탈출하려는 모든 것이 사라졌다.
피하고 싶음,싶음이 피하고 일상 전부를 있어. 잠식하고 내
피하고 싶음,진정으로 도망가고 싶어하는 느낌은 나를 먹는 것입니다.
피하고 싶음,진심으로 피하고 싶음이 나를 갉아먹는 느낌이야.
피하고 싶음,진정으로 피하고 싶다는 느낌이 나를 괴롭혔다.
피하고 싶음,나는 정말로 그것을 피하고 싶다고 느낀다.
피하고 싶음,진심으로 갉아먹는 느낌이야. 싶음이 피하고 나를
피하고 싶음,피하고 싶음이 너무 심해서 일도 못 하겠어.
피하고 싶음,그것은 피하기 어렵고 나는 아무것도 할 수 없습니다.
피하고 싶음,"도망가는 것은 너무 힘들고, 할 수 없다."
피하고 싶음,피하고 싶다는 것은 너무 힘들어서 그렇게 하지 않는다.
피하고 싶음,하겠어. 너무 일도 싶음이 못 피하고 심해서
피하고 싶음,나는 절망적이고 하루 종일 우울해졌다.
피하고 싶음,나는 하루 종일 실망하고 우울하다고 느꼈다.
피하고 싶음,계속 싶음이 피하고 우울했어. 느껴져서 종일 하루
피하고 싶음,"나는 끊임없이 탈출하고, 하루 종일 실망했다."
피하고 싶음,계속 피하고 싶음이 느껴져서 하루 종일 우울했어.
피하고 싶음,싶음이라는 할지 피하고 어떻게 감정을 표현해야 모르겠어.
