감정명,문장 예시
설렘,설렘이 계속 괜찮다고 따라다녀. 말하면서도
설렘,하루 종일 기분이 좋지 않았다.
설렘,하루 종일 기운이 없었어.
설렘,종일 없었어. 하루 기운이
설렘,당신의 마음은 복잡하고 복잡합니다.
설렘,마음이 복잡하고 어지러워.
설렘,어지러워. 마음이 복잡하고
설렘,집중하지 않고 어리석은
설렘,일상에 집중이 안 되고 멍했어.
설렘,집중이 되고 안 멍했어. 일상에
설렘,"그것은 일어나지 않지만, 나는 여전히 죽고있다."
설렘,별일 없는데 자꾸 가라앉는 기분이 들어.
설렘,자꾸 없는데 들어. 기분이 가라앉는 별일
설렘,그것은 눈물의 날과 같았다.
설렘,괜히 눈물이 날 것 같은 하루였어.
설렘,눈물이 같은 것 날 하루였어. 괜히
설렘,"혼자있을 때, 불행을 제거하십시오."
설렘,혼자 있으면 쓸쓸함이 밀려와.
설렘,있으면 혼자 밀려와. 쓸쓸함이
설렘,어렵고 피곤한 이유가 없었다.
설렘,그냥 이유 없이 지치고 힘들었어.
설렘,이유 지치고 힘들었어. 그냥 없이
설렘,아무도 아무 말도 하지 않았지만 나는 바보였다.
설렘,누가 뭐라고 한 것도 아닌데 속이 답답했어.
설렘,뭐라고 답답했어. 누가 속이 것도 한 아닌데
설렘,왜 그런지 모르겠지만 힘들다.
설렘,"내가 왜 이러는지 모르겠어, 그냥 힘들어."
설렘,"힘들어. 왜 이러는지 그냥 내가 모르겠어,"
설렘,"내가 말했을 때, 내 마음은 텅 비어 있었다."
설렘,대화를 해도 마음이 공허했어.
설렘,해도 마음이 공허했어. 대화를
설렘,나는 내 친구에게 대답할 수 없었다.
설렘,친구한테 답장할 힘도 없었어.
설렘,답장할 힘도 친구한테 없었어.
설렘,나는 앉아서 지붕을 바라보는 시간을 보냈다.
설렘,누워서 천장만 바라보며 시간을 보냈어.
설렘,바라보며 시간을 천장만 누워서 보냈어.
설렘,나는 하루 종일 창문 밖을 바라보았다.
설렘,하루 종일 창밖만 멍하니 바라봤어.
설렘,창밖만 하루 종일 바라봤어. 멍하니
설렘,나는 심지어 샤워를 하지 않았다.
설렘,샤워할 기운조차 없었어.
설렘,없었어. 샤워할 기운조차
설렘,나는 하루 종일 방에서 조용했다.
설렘,하루 종일 방 안에서 조용히 있었어.
설렘,방 있었어. 하루 종일 안에서 조용히
설렘,나는 휴대폰을 보면서 시간을 보냈다.
설렘,핸드폰만 들여다보면서 시간을 보냈어.
설렘,들여다보면서 보냈어. 시간을 핸드폰만
설렘,오늘은 아무것도 하지 않고 침대에 누워있었습니다.
설렘,오늘 아무것도 하지 않고 침대에만 누워 있었어.
설렘,누워 하지 오늘 있었어. 않고 아무것도 침대에만
설렘,나는 바보였고 그냥 바보였다.
설렘,밥도 거르고 그냥 멍하니 있었어.
설렘,밥도 거르고 멍하니 있었어. 그냥
설렘,거울 속에서 이상하게 느껴졌다.
설렘,거울 속 내 모습이 낯설게 느껴졌어.
설렘,느껴졌어. 낯설게 모습이 속 거울 내
설렘,나는 집안일을 하지 않았고 시간을 보냈다.
설렘,집안일 하나도 못 하고 시간을 흘려보냈어.
설렘,집안일 시간을 못 하고 흘려보냈어. 하나도
안정감,나는 안정성의 느낌을 표현하는 방법을 모르겠다.
안정감,안정감이라는 감정을 어떻게 표현해야 할지 모르겠어.
안정감,안정감이라는 할지 표현해야 어떻게 감정을 모르겠어.
안정감,나는 진정으로 안정성의 느낌을 느낀다.
안정감,진심으로 안정감이 나를 갉아먹는 느낌이야.
안정감,갉아먹는 안정감이 나를 느낌이야. 진심으로
안정감,어쩌면 안정성 때문에 울었을지도 모른다.
안정감,"말없이 눈물만 나, 아마 안정감 때문일 거야."
안정감,"거야. 눈물만 때문일 말없이 나, 아마 안정감"
안정감,당신이 미친 사람이라면 안정성을 유지하십시오.
안정감,그냥 멍하게 있다 보면 안정감이 밀려와.
안정감,보면 멍하게 밀려와. 안정감이 있다 그냥
안정감,나는 하루 종일 안정적이었다.
안정감,하루 종일 안정감 생각뿐이었어.
안정감,하루 생각뿐이었어. 안정감 종일
안정감,"나는 말하지 않았다, 그러나 나는 여전히 안정적이었다."
안정감,말은 못 했지만 속으로는 계속 안정감하고 있었어.
안정감,못 속으로는 했지만 안정감하고 있었어. 말은 계속
안정감,"그것은 안정적이고 안정적이며, 지금은 불안정합니다."
안정감,안정감이 쌓이고 쌓여서 이제는 무뎌진 것 같아.
안정감,무뎌진 이제는 같아. 쌓이고 쌓여서 안정감이 것
안정감,그것은 너무 안정적이어서 일할 수 없습니다.
안정감,안정감이 너무 심해서 일도 못 하겠어.
안정감,하겠어. 일도 안정감이 너무 못 심해서
안정감,계속 안정적으로 느껴집니다.
안정감,자꾸 안정감에 잠식당하는 기분이야.
안정감,안정감에 잠식당하는 자꾸 기분이야.
안정감,때때로 나는 안정성 없이 살고 싶다고 생각한다.
안정감,가끔은 안정감 없이 살고 싶다는 생각이 들어.
안정감,생각이 가끔은 싶다는 살고 들어. 안정감 없이
안정감,"내가 말했을 때, 내 마음은 텅 비어 있었다."
안정감,대화를 해도 마음이 공허했어.
안정감,마음이 대화를 해도 공허했어.
안정감,하루 종일 기분이 좋지 않았다.
안정감,하루 종일 기운이 없었어.
안정감,기운이 하루 종일 없었어.
안정감,왜 그런지 모르겠지만 힘들다.
안정감,"내가 왜 이러는지 모르겠어, 그냥 힘들어."
안정감,"힘들어. 이러는지 왜 모르겠어, 그냥 내가"
안정감,"그것은 일어나지 않지만, 나는 여전히 죽고있다."
안정감,별일 없는데 자꾸 가라앉는 기분이 들어.
안정감,가라앉는 자꾸 없는데 기분이 들어. 별일
안정감,당신의 마음은 복잡하고 복잡합니다.
안정감,마음이 복잡하고 어지러워.
안정감,마음이 복잡하고 어지러워.
안정감,집중하지 않고 어리석은
안정감,일상에 집중이 안 되고 멍했어.
안정감,멍했어. 일상에 되고 안 집중이
안정감,그것은 눈물의 날과 같았다.
안정감,괜히 눈물이 날 것 같은 하루였어.
안정감,것 같은 괜히 눈물이 날 하루였어.
안정감,"혼자있을 때, 불행을 제거하십시오."
안정감,혼자 있으면 쓸쓸함이 밀려와.
안정감,쓸쓸함이 혼자 밀려와. 있으면
안정감,아무도 아무 말도 하지 않았지만 나는 바보였다.
안정감,누가 뭐라고 한 것도 아닌데 속이 답답했어.
안정감,속이 답답했어. 아닌데 누가 뭐라고 것도 한
안정감,어렵고 피곤한 이유가 없었다.
안정감,그냥 이유 없이 지치고 힘들었어.
안정감,없이 그냥 힘들었어. 지치고 이유
안정감,거울 속에서 이상하게 느껴졌다.
안정감,거울 속 내 모습이 낯설게 느껴졌어.
안정감,내 모습이 느껴졌어. 속 거울 낯설게
안정감,나는 하루 종일 창문 밖을 바라보았다.
안정감,하루 종일 창밖만 멍하니 바라봤어.
안정감,창밖만 멍하니 바라봤어. 종일 하루
안정감,오늘은 아무것도 하지 않고 침대에 누워있었습니다.
안정감,오늘 아무것도 하지 않고 침대에만 누워 있었어.
안정감,침대에만 하지 아무것도 않고 있었어. 누워 오늘
안정감,나는 심지어 샤워를 하지 않았다.
안정감,샤워할 기운조차 없었어.
안정감,없었어. 기운조차 샤워할
안정감,나는 하루 종일 방에서 조용했다.
안정감,하루 종일 방 안에서 조용히 있었어.
안정감,안에서 하루 종일 방 조용히 있었어.
안정감,나는 바보였고 그냥 바보였다.
안정감,밥도 거르고 그냥 멍하니 있었어.
안정감,거르고 밥도 그냥 멍하니 있었어.
안정감,나는 휴대폰을 보면서 시간을 보냈다.
안정감,핸드폰만 들여다보면서 시간을 보냈어.
안정감,들여다보면서 보냈어. 핸드폰만 시간을
안정감,나는 내 친구에게 대답할 수 없었다.
안정감,친구한테 답장할 힘도 없었어.
안정감,친구한테 없었어. 답장할 힘도
안정감,나는 집안일을 하지 않았고 시간을 보냈다.
안정감,집안일 하나도 못 하고 시간을 흘려보냈어.
안정감,흘려보냈어. 집안일 하고 못 하나도 시간을
안정감,나는 앉아서 지붕을 바라보는 시간을 보냈다.
안정감,누워서 천장만 바라보며 시간을 보냈어.
안정감,누워서 천장만 바라보며 보냈어. 시간을
행복,때때로 나는 행복 없이 살고 싶다.
행복,가끔은 행복 없이 살고 싶다는 생각이 들어.
행복,행복 들어. 살고 가끔은 없이 생각이 싶다는
행복,그렇게 오랫동안 행복을 느끼는 것은 처음이었습니다.
행복,행복이라는 감정을 이렇게 오래 느낀 건 처음이야.
행복,행복이라는 처음이야. 느낀 감정을 건 오래 이렇게
행복,"나는 말하지 않았다, 그러나 나는 여전히 행복했다."
행복,말은 못 했지만 속으로는 계속 행복하고 있었어.
행복,속으로는 계속 말은 했지만 행복하고 못 있었어.
행복,행복한 날이었고 특별한 것은 없었다.
행복,"그냥 행복한 하루였어, 특별한 일도 없는데."
행복,"특별한 없는데. 그냥 일도 하루였어, 행복한"
행복,행복을 위해 웃는 것은 이상한 일이었다.
행복,행복 때문에 웃는 게 어색해졌어.
행복,웃는 어색해졌어. 행복 게 때문에
행복,당신이 바보라면 행복을 얻으십시오.
행복,그냥 멍하게 있다 보면 행복이 밀려와.
행복,멍하게 보면 그냥 행복이 밀려와. 있다
행복,무슨 일이 일어나든 행복은 사라지지 않는다.
행복,무슨 일이 있어도 행복은 좀처럼 사라지지 않아.
행복,사라지지 좀처럼 행복은 있어도 무슨 않아. 일이
행복,"만약 그 행복이 계속된다면, 그것은 떨어질 것이다."
행복,이런 행복이 계속되면 무너질 것 같아.
행복,계속되면 무너질 것 행복이 같아. 이런
행복,"솔직히 말하자면, 나는 지금 행복을 위해 힘들다."
행복,솔직히 말해서 나 지금 행복 때문에 힘들어.
행복,말해서 솔직히 행복 지금 때문에 힘들어. 나
행복,"그것이 좋은 것처럼 보이더라도, 그것은 완전한 행복입니다."
행복,겉으로는 멀쩡해 보여도 속은 완전 행복이야.
행복,완전 겉으로는 속은 보여도 멀쩡해 행복이야.
행복,왜 그런지 모르겠지만 힘들다.
행복,"내가 왜 이러는지 모르겠어, 그냥 힘들어."
행복,"이러는지 힘들어. 왜 그냥 모르겠어, 내가"
행복,당신의 마음은 복잡하고 복잡합니다.
행복,마음이 복잡하고 어지러워.
행복,마음이 어지러워. 복잡하고
행복,집중하지 않고 어리석은
행복,일상에 집중이 안 되고 멍했어.
행복,멍했어. 안 집중이 일상에 되고
행복,어렵고 피곤한 이유가 없었다.
행복,그냥 이유 없이 지치고 힘들었어.
행복,힘들었어. 지치고 그냥 이유 없이
행복,하루 종일 기분이 좋지 않았다.
행복,하루 종일 기운이 없었어.
행복,기운이 없었어. 종일 하루
행복,"혼자있을 때, 불행을 제거하십시오."
행복,혼자 있으면 쓸쓸함이 밀려와.
행복,쓸쓸함이 있으면 밀려와. 혼자
행복,아무도 아무 말도 하지 않았지만 나는 바보였다.
행복,누가 뭐라고 한 것도 아닌데 속이 답답했어.
행복,아닌데 누가 것도 답답했어. 한 뭐라고 속이
행복,"그것은 일어나지 않지만, 나는 여전히 죽고있다."
행복,별일 없는데 자꾸 가라앉는 기분이 들어.
행복,자꾸 가라앉는 기분이 들어. 없는데 별일
행복,그것은 눈물의 날과 같았다.
행복,괜히 눈물이 날 것 같은 하루였어.
행복,것 괜히 같은 눈물이 하루였어. 날
행복,"내가 말했을 때, 내 마음은 텅 비어 있었다."
행복,대화를 해도 마음이 공허했어.
행복,해도 마음이 대화를 공허했어.
행복,나는 앉아서 지붕을 바라보는 시간을 보냈다.
행복,누워서 천장만 바라보며 시간을 보냈어.
행복,바라보며 누워서 시간을 보냈어. 천장만
행복,나는 심지어 샤워를 하지 않았다.
행복,샤워할 기운조차 없었어.
행복,기운조차 샤워할 없었어.
행복,나는 휴대폰을 보면서 시간을 보냈다.
행복,핸드폰만 들여다보면서 시간을 보냈어.
행복,시간을 핸드폰만 보냈어. 들여다보면서
행복,나는 집안일을 하지 않았고 시간을 보냈다.
행복,집안일 하나도 못 하고 시간을 흘려보냈어.
행복,집안일 못 하나도 흘려보냈어. 시간을 하고
행복,나는 하루 종일 창문 밖을 바라보았다.
행복,하루 종일 창밖만 멍하니 바라봤어.
행복,바라봤어. 하루 종일 창밖만 멍하니
행복,나는 하루 종일 방에서 조용했다.
행복,하루 종일 방 안에서 조용히 있었어.
행복,조용히 안에서 있었어. 방 하루 종일
행복,나는 내 친구에게 대답할 수 없었다.
행복,친구한테 답장할 힘도 없었어.
행복,힘도 없었어. 답장할 친구한테
행복,나는 바보였고 그냥 바보였다.
행복,밥도 거르고 그냥 멍하니 있었어.
행복,밥도 그냥 멍하니 거르고 있었어.
행복,거울 속에서 이상하게 느껴졌다.
행복,거울 속 내 모습이 낯설게 느껴졌어.
행복,거울 느껴졌어. 모습이 낯설게 내 속
행복,오늘은 아무것도 하지 않고 침대에 누워있었습니다.
행복,오늘 아무것도 하지 않고 침대에만 누워 있었어.
행복,있었어. 하지 않고 누워 아무것도 오늘 침대에만
편안함,"사람들은 모른다, 나는 매우 편안하다."
편안함,사람들이 모를 뿐이지 나 진짜 편안함해.
편안함,편안함해. 뿐이지 진짜 사람들이 모를 나
편안함,나는 하루 종일 편안했다.
편안함,하루 종일 편안함 생각뿐이었어.
편안함,생각뿐이었어. 종일 편안함 하루
편안함,나는 오랫동안 그렇게 편안하게 느꼈던 것은 처음이었다.
편안함,편안함이라는 감정을 이렇게 오래 느낀 건 처음이야.
편안함,편안함이라는 감정을 오래 처음이야. 이렇게 건 느낀
편안함,외부에서 잘 보이지만 완전히 편안합니다.
편안함,겉으로는 멀쩡해 보여도 속은 완전 편안함이야.
편안함,편안함이야. 보여도 완전 멀쩡해 속은 겉으로는
편안함,그는 괜찮다고 말하지만 여전히 편안하다.
편안함,괜찮다고 말하면서도 계속 편안함이 따라다녀.
편안함,말하면서도 편안함이 계속 괜찮다고 따라다녀.
편안함,때때로 나는 편안함 없이 살고 싶다.
편안함,가끔은 편안함 없이 살고 싶다는 생각이 들어.
편안함,싶다는 들어. 편안함 가끔은 생각이 살고 없이
편안함,나는 하루 종일 편안하고 우울했다.
편안함,계속 편안함이 느껴져서 하루 종일 우울했어.
편안함,느껴져서 계속 종일 우울했어. 편안함이 하루
편안함,이제는 이것이 편안해지고 싶습니다.
편안함,지금 이 상태가 편안함인 건가 싶어.
편안함,싶어. 상태가 편안함인 건가 이 지금
편안함,편안함 때문에 웃는 것이 이상했습니다.
편안함,편안함 때문에 웃는 게 어색해졌어.
편안함,어색해졌어. 편안함 때문에 게 웃는
편안함,"나는 말하지 않았다, 그러나 나는 여전히 편안했다."
편안함,말은 못 했지만 속으로는 계속 편안함하고 있었어.
편안함,계속 편안함하고 했지만 못 있었어. 말은 속으로는
편안함,"혼자있을 때, 불행을 제거하십시오."
편안함,혼자 있으면 쓸쓸함이 밀려와.
편안함,밀려와. 혼자 있으면 쓸쓸함이
편안함,당신의 마음은 복잡하고 복잡합니다.
편안함,마음이 복잡하고 어지러워.
편안함,마음이 어지러워. 복잡하고
편안함,"내가 말했을 때, 내 마음은 텅 비어 있었다."
편안함,대화를 해도 마음이 공허했어.
편안함,마음이 해도 공허했어. 대화를
편안함,아무도 아무 말도 하지 않았지만 나는 바보였다.
편안함,누가 뭐라고 한 것도 아닌데 속이 답답했어.
편안함,속이 답답했어. 한 것도 뭐라고 누가 아닌데
편안함,집중하지 않고 어리석은
편안함,일상에 집중이 안 되고 멍했어.
편안함,멍했어. 집중이 일상에 안 되고
편안함,"그것은 일어나지 않지만, 나는 여전히 죽고있다."
편안함,별일 없는데 자꾸 가라앉는 기분이 들어.
편안함,들어. 없는데 자꾸 기분이 별일 가라앉는
편안함,하루 종일 기분이 좋지 않았다.
편안함,하루 종일 기운이 없었어.
편안함,하루 기운이 없었어. 종일
편안함,왜 그런지 모르겠지만 힘들다.
편안함,"내가 왜 이러는지 모르겠어, 그냥 힘들어."
편안함,"그냥 내가 모르겠어, 왜 힘들어. 이러는지"
편안함,어렵고 피곤한 이유가 없었다.
편안함,그냥 이유 없이 지치고 힘들었어.
편안함,그냥 지치고 없이 힘들었어. 이유
편안함,그것은 눈물의 날과 같았다.
편안함,괜히 눈물이 날 것 같은 하루였어.
편안함,하루였어. 날 괜히 눈물이 것 같은
편안함,오늘은 아무것도 하지 않고 침대에 누워있었습니다.
편안함,오늘 아무것도 하지 않고 침대에만 누워 있었어.
편안함,하지 않고 침대에만 누워 있었어. 오늘 아무것도
편안함,나는 심지어 샤워를 하지 않았다.
편안함,샤워할 기운조차 없었어.
편안함,없었어. 기운조차 샤워할
편안함,나는 바보였고 그냥 바보였다.
편안함,밥도 거르고 그냥 멍하니 있었어.
편안함,거르고 그냥 밥도 있었어. 멍하니
편안함,나는 하루 종일 창문 밖을 바라보았다.
편안함,하루 종일 창밖만 멍하니 바라봤어.
편안함,멍하니 바라봤어. 하루 종일 창밖만
편안함,나는 앉아서 지붕을 바라보는 시간을 보냈다.
편안함,누워서 천장만 바라보며 시간을 보냈어.
편안함,시간을 보냈어. 누워서 천장만 바라보며
편안함,나는 집안일을 하지 않았고 시간을 보냈다.
편안함,집안일 하나도 못 하고 시간을 흘려보냈어.
편안함,집안일 흘려보냈어. 시간을 하나도 하고 못
편안함,거울 속에서 이상하게 느껴졌다.
편안함,거울 속 내 모습이 낯설게 느껴졌어.
편안함,낯설게 모습이 거울 느껴졌어. 내 속
편안함,나는 내 친구에게 대답할 수 없었다.
편안함,친구한테 답장할 힘도 없었어.
편안함,친구한테 답장할 없었어. 힘도
편안함,나는 하루 종일 방에서 조용했다.
편안함,하루 종일 방 안에서 조용히 있었어.
편안함,조용히 있었어. 방 종일 안에서 하루
편안함,나는 휴대폰을 보면서 시간을 보냈다.
편안함,핸드폰만 들여다보면서 시간을 보냈어.
편안함,시간을 핸드폰만 보냈어. 들여다보면서
만족,"오늘날, 진정한 만족 때문에 아무것도 손에 들지 않습니다."
만족,요즘 진짜 만족 때문에 아무것도 손에 안 잡혀.
만족,손에 아무것도 요즘 잡혀. 진짜 때문에 안 만족
만족,나는 정말로 나 자신에 만족한다.
만족,진심으로 만족이 나를 갉아먹는 느낌이야.
만족,나를 진심으로 느낌이야. 만족이 갉아먹는
만족,잘 보이지만 완전히 만족합니다.
만족,겉으로는 멀쩡해 보여도 속은 완전 만족이야.
만족,겉으로는 멀쩡해 보여도 만족이야. 속은 완전
만족,그는 괜찮다고 말하고 계속 기뻐한다.
만족,괜찮다고 말하면서도 계속 만족이 따라다녀.
만족,계속 따라다녀. 괜찮다고 만족이 말하면서도
만족,나는 지금 이 상황에 만족하고 싶다.
만족,지금 이 상태가 만족인 건가 싶어.
만족,상태가 건가 지금 만족인 싶어. 이
만족,즐거운 하루였고 특별한 일이 없었다.
만족,"그냥 만족한 하루였어, 특별한 일도 없는데."
만족,"일도 하루였어, 그냥 특별한 만족한 없는데."
만족,"나는 말하지 않았다, 그러나 나는 여전히 행복했다."
만족,말은 못 했지만 속으로는 계속 만족하고 있었어.
만족,있었어. 계속 했지만 만족하고 말은 속으로는 못
만족,그는 여전히 만족감을 느낀다.
만족,자꾸 만족에 잠식당하는 기분이야.
만족,만족에 기분이야. 자꾸 잠식당하는
만족,"만약 이 만족도가 계속된다면, 그것은 떨어질 것이다."
만족,이런 만족이 계속되면 무너질 것 같아.
만족,것 같아. 계속되면 이런 만족이 무너질
만족,나는 내 인생의 모든 것에 만족한다.
만족,만족이 내 일상 전부를 잠식하고 있어.
만족,일상 전부를 잠식하고 만족이 있어. 내
만족,집중하지 않고 어리석은
만족,일상에 집중이 안 되고 멍했어.
만족,일상에 멍했어. 안 집중이 되고
만족,당신의 마음은 복잡하고 복잡합니다.
만족,마음이 복잡하고 어지러워.
만족,복잡하고 어지러워. 마음이
만족,아무도 아무 말도 하지 않았지만 나는 바보였다.
만족,누가 뭐라고 한 것도 아닌데 속이 답답했어.
만족,것도 한 답답했어. 아닌데 뭐라고 속이 누가
만족,어렵고 피곤한 이유가 없었다.
만족,그냥 이유 없이 지치고 힘들었어.
만족,없이 힘들었어. 지치고 그냥 이유
만족,하루 종일 기분이 좋지 않았다.
만족,하루 종일 기운이 없었어.
만족,종일 없었어. 기운이 하루
만족,"내가 말했을 때, 내 마음은 텅 비어 있었다."
만족,대화를 해도 마음이 공허했어.
만족,공허했어. 대화를 해도 마음이
만족,그것은 눈물의 날과 같았다.
만족,괜히 눈물이 날 것 같은 하루였어.
만족,날 하루였어. 것 괜히 눈물이 같은
만족,"그것은 일어나지 않지만, 나는 여전히 죽고있다."
만족,별일 없는데 자꾸 가라앉는 기분이 들어.
만족,들어. 가라앉는 기분이 별일 자꾸 없는데
만족,왜 그런지 모르겠지만 힘들다.
만족,"내가 왜 이러는지 모르겠어, 그냥 힘들어."
만족,"모르겠어, 그냥 내가 힘들어. 이러는지 왜"
만족,"혼자있을 때, 불행을 제거하십시오."
만족,혼자 있으면 쓸쓸함이 밀려와.
만족,있으면 혼자 쓸쓸함이 밀려와.
만족,나는 앉아서 지붕을 바라보는 시간을 보냈다.
만족,누워서 천장만 바라보며 시간을 보냈어.
만족,시간을 누워서 천장만 보냈어. 바라보며
만족,나는 하루 종일 창문 밖을 바라보았다.
만족,하루 종일 창밖만 멍하니 바라봤어.
만족,종일 하루 바라봤어. 창밖만 멍하니
만족,나는 내 친구에게 대답할 수 없었다.
만족,친구한테 답장할 힘도 없었어.
만족,친구한테 없었어. 답장할 힘도
만족,나는 하루 종일 방에서 조용했다.
만족,하루 종일 방 안에서 조용히 있었어.
만족,있었어. 안에서 하루 종일 조용히 방
만족,나는 바보였고 그냥 바보였다.
만족,밥도 거르고 그냥 멍하니 있었어.
만족,있었어. 밥도 그냥 멍하니 거르고
만족,오늘은 아무것도 하지 않고 침대에 누워있었습니다.
만족,오늘 아무것도 하지 않고 침대에만 누워 있었어.
만족,않고 오늘 있었어. 하지 침대에만 누워 아무것도
만족,나는 심지어 샤워를 하지 않았다.
만족,샤워할 기운조차 없었어.
만족,없었어. 기운조차 샤워할
만족,나는 집안일을 하지 않았고 시간을 보냈다.
만족,집안일 하나도 못 하고 시간을 흘려보냈어.
만족,못 하고 집안일 흘려보냈어. 하나도 시간을
만족,거울 속에서 이상하게 느껴졌다.
만족,거울 속 내 모습이 낯설게 느껴졌어.
만족,느껴졌어. 모습이 내 속 낯설게 거울
만족,나는 휴대폰을 보면서 시간을 보냈다.
만족,핸드폰만 들여다보면서 시간을 보냈어.
만족,들여다보면서 시간을 보냈어. 핸드폰만
충족감,잘 보이지만 완전히 만족스럽게 보입니다.
충족감,겉으로는 멀쩡해 보여도 속은 완전 충족감이야.
충족감,멀쩡해 겉으로는 속은 완전 충족감이야. 보여도
충족감,나는 정말로 나 자신에 만족한다.
충족감,진심으로 충족감이 나를 갉아먹는 느낌이야.
충족감,느낌이야. 충족감이 나를 진심으로 갉아먹는
충족감,"나는 왜 그렇게 만족하는지, 나는 모른다."
충족감,"왜 이렇게 충족감하지, 나도 모르겠어."
충족감,"왜 나도 충족감하지, 이렇게 모르겠어."
충족감,나는 너무 만족해서 사람들을 만나는 것을 좋아하지 않는다.
충족감,충족감이 너무 심해서 사람 만나기도 싫어.
충족감,만나기도 너무 심해서 싫어. 사람 충족감이
